{"manifestId":"scope-1","contentHash":"aaaaaaaaaaaaaaaaaaaaaaaaaaaaaaaaaaaaaaaaaaaaaaaaaaaaaaaaaaaaaaaa","rootArtifacts":[{"artifactId":"screen-1","artifactType":"THYMELEAF_SCREEN","schemaVersion":"1.0","contentHash":"bbbbbbbbbbbbbbbbbbbbbbbbbbbbbbbbbbbbbbbbbbbbbbbbbbbbbbbbbbbbbbbb","sourceRevision":"r1"}],"dependencyArtifacts":[],"validationOnlyArtifacts":[],"preservedArtifacts":[],"affectedScreens":["qna-list"],"selectionReason":"목록 화면 생성","unresolvedDependencies":[]}
